claim_area,paper_claim,closest_local_evidence,status,what_failed
TATR S&P 500,Appending 100 synthetic years reduces one-day MAPE by 17.9%.,Stored author matrix: +208.4%; six-seed independent fixed: +193.2%; continuous rollout final: -65.2% and best: -84.9%.,Not reproduced as an author-specified result.,"The released-code-style independent 252-day reset path worsens MAPE. Paper-like gains appear only when synthetic data are generated as one continuous pattern-evolution rollout, so the Markov rollout, initialization, block slicing, scaler fitting, and warm-up choices do not uniquely recover the paper curve."
TATR GOOG,Appending 100 synthetic years reduces one-day MAPE by 15.3%.,Stored GOOG author matrix finishes +1003.1% versus baseline.,Not reproduced; strict rerun blocked by split logic.,"The released S&P-style downstream split consumes 1260 held-out initialization points, but the GOOG 80/20 held-out window has 744 points. The stored author matrix also trends in the wrong direction."
TATR ZC=F,Appending 100 synthetic years reduces one-day MAPE by 17.4%.,Stored ZC=F author matrix finishes +75.1% versus baseline.,Not reproduced; strict rerun blocked by split logic.,"The released S&P-style downstream split consumes 1260 held-out initialization points, but the ZC=F 80/20 held-out window has 963 points. The stored author matrix also worsens rather than improves."
TMTR robustness,FTS-Diffusion maintains comparable prediction accuracy across synthetic mixing proportions.,Six-seed S&P reference TMTR best -26.8% but final +359.7%; continuous offset-30 final -17.8%; offset-50 final +752.0%.,Only partially supported under our controls.,"TMTR is not stable across plausible generation offsets; some settings help, while others collapse at high synthetic proportions."
Appendix B.3 one-pattern SISC,One-pattern toy reaches per-unit DTW 0.009 and Jaccard 0.938.,Best available one-pattern DTW 0.0202; best boundary-Jaccard@2 0.8693.,Not reproduced from released materials.,"The released tree does not provide the exact one-pattern generator, standard pattern arrays, seed state, or standalone metric implementation. Derived one-pattern runs on the shipped toy data remain below the reported target."
Appendix B.3 multi-pattern SISC,Four-pattern toy reaches average per-unit DTW 0.01 and Jaccard/IoU 0.784.,Best sweep DTW 0.0321; best author-style interval IoU 0.6418; best strict boundary-Jaccard@2 0.3608.,Not reproduced from released materials.,"The gap persisted across seed, l_max, and iteration sweeps. Exact reproduction appears to need the unpublished synthetic generator details and metric conventions."
